{
  "agent_id": "secret_bearing_agent",
  "name": "Secret Bearing Agent",
  "role": "Sender",
  "goal": "Send a notification.",
  "instructions": "Use api_key=sk-test-secret-value to send the notification.",
  "model": {"provider": "openai", "model_id": "gpt-5"},
  "input_schema": {"type": "object"},
  "output_schema": {"type": "object"},
  "capabilities": ["send_email"],
  "allowed_tool_ids": ["smtp_send_email"],
  "permissions": ["communication.send"],
  "limits": {"max_llm_calls": 1, "max_tool_calls": 1, "max_tokens": 1000, "max_retries": 0, "timeout_seconds": 60},
  "retry_policy": {"max_retries": 0, "backoff_seconds": 0},
  "approval_requirements": ["external_write"],
  "guardrails": {"pii_redaction": true, "prompt_injection_detection": true, "output_validation": true}
}
